{
  "$schema": "./key-mapping.schema.json",
  "name": "C Major",
  "description": "Same four-string layout as the default, but every key plays a note in C major (C D E F G A B). Sharps and flats are skipped — each key steps to the next diatonic note.",
  "version": 1,
  "mappings": {
    "z": { "note": 28, "channel": 1, "label": "E1" },
    "x": { "note": 29, "channel": 1, "label": "F1" },
    "c": { "note": 31, "channel": 1, "label": "G1" },
    "v": { "note": 33, "channel": 1, "label": "A1" },
    "b": { "note": 35, "channel": 1, "label": "B1" },
    "n": { "note": 36, "channel": 1, "label": "C2" },
    "m": { "note": 38, "channel": 1, "label": "D2" },
    ",": { "note": 40, "channel": 1, "label": "E2" },
    ".": { "note": 41, "channel": 1, "label": "F2" },
    "/": { "note": 43, "channel": 1, "label": "G2" },

    "a": { "note": 33, "channel": 2, "label": "A1" },
    "s": { "note": 35, "channel": 2, "label": "B1" },
    "d": { "note": 36, "channel": 2, "label": "C2" },
    "f": { "note": 38, "channel": 2, "label": "D2" },
    "g": { "note": 40, "channel": 2, "label": "E2" },
    "h": { "note": 41, "channel": 2, "label": "F2" },
    "j": { "note": 43, "channel": 2, "label": "G2" },
    "k": { "note": 45, "channel": 2, "label": "A2" },
    "l": { "note": 47, "channel": 2, "label": "B2" },
    ";": { "note": 48, "channel": 2, "label": "C3" },

    "q": { "note": 38, "channel": 3, "label": "D2" },
    "w": { "note": 40, "channel": 3, "label": "E2" },
    "e": { "note": 41, "channel": 3, "label": "F2" },
    "r": { "note": 43, "channel": 3, "label": "G2" },
    "t": { "note": 45, "channel": 3, "label": "A2" },
    "y": { "note": 47, "channel": 3, "label": "B2" },
    "u": { "note": 48, "channel": 3, "label": "C3" },
    "i": { "note": 50, "channel": 3, "label": "D3" },
    "o": { "note": 52, "channel": 3, "label": "E3" },
    "p": { "note": 53, "channel": 3, "label": "F3" },

    "1": { "note": 43, "channel": 4, "label": "G2" },
    "2": { "note": 45, "channel": 4, "label": "A2" },
    "3": { "note": 47, "channel": 4, "label": "B2" },
    "4": { "note": 48, "channel": 4, "label": "C3" },
    "5": { "note": 50, "channel": 4, "label": "D3" },
    "6": { "note": 52, "channel": 4, "label": "E3" },
    "7": { "note": 53, "channel": 4, "label": "F3" },
    "8": { "note": 55, "channel": 4, "label": "G3" },
    "9": { "note": 57, "channel": 4, "label": "A3" },
    "0": { "note": 59, "channel": 4, "label": "B3" }
  }
}
